{
  "schema_version": "0.1",
  "job_id": "job_checkpoint_research_loop_small",
  "job_type": "checkpoint_thread",
  "created_at": "2026-06-16T17:30:00-05:00",
  "requested_by": "model-plane",
  "params": {
    "thread_id": "research-loop-small",
    "mode": "soft"
  },
  "notes": [
    "Soft checkpoint packets do not require a live runtime slot."
  ]
}
