{
  "schema_version": "0.1",
  "job_id": "job_validate_research_loop_small",
  "job_type": "validate_capsule",
  "created_at": "2026-06-16T17:30:00-05:00",
  "requested_by": "model-plane",
  "params": {
    "thread_id": "research-loop-small",
    "capsule_id": null,
    "require_snapshot": false
  },
  "notes": [
    "A null capsule_id means validate the active capsule in the thread ledger."
  ]
}
