{
  "schema_version": "0.1",
  "job_id": "job_export_research_loop_small",
  "job_type": "export_thread",
  "created_at": "2026-06-16T17:30:00-05:00",
  "requested_by": "model-plane",
  "params": {
    "thread_id": "research-loop-small",
    "out": "research-loop-small.scap",
    "include_snapshots": false,
    "redact_transcript": false,
    "force": false
  },
  "notes": [
    "Relative output paths are resolved from the job packet directory.",
    "Signing keys are supplied to capsule_cli.py job run, not stored in this packet."
  ]
}
