{
  "schema_version": "0.1",
  "job_id": "job_resume_research_loop_small",
  "job_type": "resume_thread",
  "created_at": "2026-06-16T17:30:00-05:00",
  "requested_by": "model-plane",
  "params": {
    "thread_id": "research-loop-small",
    "slot": 0,
    "append_diff": true,
    "chat_path": "/v1/chat/completions",
    "max_tokens": 0,
    "temperature": 0.0,
    "timeout": 120.0
  },
  "notes": [
    "The harness chooses the latest compatible hard capsule unless capsule_id is supplied."
  ]
}
